{
  "skill": {
    "name": "webgl2-systems-architect-skill",
    "version": "2.0.0"
  },
  "task": {
    "intent": "architecture",
    "project_class": "sdf-raymarch",
    "subject": "human face bust",
    "locale": "en",
    "target_platforms": [
      "mobile Safari",
      "desktop Chrome"
    ],
    "fps_target": 60
  },
  "inputs": {
    "artifacts": [
      {
        "kind": "prompt-only",
        "label": "user brief",
        "used": true
      }
    ],
    "hardware_data_quality": "estimated",
    "constraints": [
      "phone-sized canvas",
      "60 FPS target",
      "anatomical credibility at medium-close framing",
      "tiered feature fallback required"
    ]
  },
  "modules": [
    "skills/core/01-triage.md",
    "skills/core/02-hardware-budget.md",
    "skills/core/03-pipeline-and-concurrency.md",
    "skills/core/04-subject-audit.md",
    "skills/core/05-shader-rules.md",
    "skills/core/06-runtime-ops.md",
    "skills/core/07-validation-and-ci.md"
  ],
  "assumptions": [
    {
      "statement": "Target DPR should be capped near 2.0 unless differential measurements prove extra GPU fragment headroom.",
      "confidence": "medium"
    },
    {
      "statement": "The renderer uses a primary fullscreen SDF raymarch pass plus optional half-resolution auxiliary passes.",
      "confidence": "medium"
    },
    {
      "statement": "Actual GPU capability limits and extension availability must be queried at runtime via gl.getParameter and gl.getExtension.",
      "confidence": "high"
    }
  ],
  "decisions": [
    {
      "area": "context",
      "decision": "Create WebGL2 context with alpha: false, depth: false, stencil: false, antialias: false, and powerPreference: 'high-performance'.",
      "rationale": "A fullscreen SDF pass computes analytic intersections directly and avoids default-framebuffer depth/MSAA allocations.",
      "confidence": "high"
    },
    {
      "area": "subject-hierarchy",
      "decision": "Prioritize cranial-to-jaw proportions, orbital socket depth, eyelid wrap, and nose-to-lip transitions as P0 before adding P2 skin pore noise.",
      "rationale": "Macro anatomical proportions dominate viewer recognition at medium-close framing.",
      "confidence": "high"
    },
    {
      "area": "pipeline-concurrency",
      "decision": "Poll KHR_parallel_shader_compile asynchronously across frames and bind a dedicated VAO + std140 FrameBlock UBO for the fullscreen triangle pass.",
      "rationale": "Avoids main-thread LINK_STATUS stalls during boot and satisfies strict WebGL 2.0 VAO/UBO contracts.",
      "confidence": "high"
    }
  ],
  "derivations": [
    {
      "name": "frameBudgetMs",
      "formula": "1000 / fps_target",
      "values": {
        "fps_target": 60
      },
      "result": 16.67,
      "units": "ms",
      "notes": "Total frame time budget at 60 FPS."
    },
    {
      "name": "gpuBudgetMs",
      "formula": "frameBudgetMs - cpuReserveMs - compositorReserveMs",
      "values": {
        "frameBudgetMs": 16.67,
        "cpuReserveMs": 2.2,
        "compositorReserveMs": 1.8
      },
      "result": 12.67,
      "units": "ms",
      "notes": "Available GPU execution window on mobile."
    },
    {
      "name": "SURF_HIT_EPS",
      "formula": "0.0005 / headRadiusMeters",
      "values": {
        "surfaceToleranceMeters": 0.0005,
        "headRadiusMeters": 0.12
      },
      "result": 0.0042,
      "units": "head-radius units",
      "notes": "0.5 mm surface intersection threshold normalized to a 0.12 m head radius."
    }
  ],
  "parallel_plan": {
    "execution_mode": "parallel",
    "lanes": [
      {
        "lane": "A",
        "purpose": "hardware budget and capability tiering",
        "independent_of": [
          "B",
          "C"
        ],
        "outputs": [
          "frame budget math",
          "DPR clamp policy",
          "tier table"
        ]
      },
      {
        "lane": "B",
        "purpose": "subject audit and P0/P1/P2 visual hierarchy",
        "independent_of": [
          "A",
          "C"
        ],
        "outputs": [
          "anatomical feature ranking",
          "budget cut order",
          "visual definition of done"
        ]
      },
      {
        "lane": "C",
        "purpose": "pipeline and startup flow",
        "independent_of": [
          "A",
          "B"
        ],
        "outputs": [
          "pass graph",
          "async boot sequence",
          "KHR_parallel_shader_compile polling strategy"
        ]
      },
      {
        "lane": "D",
        "purpose": "shader and runtime risk review",
        "independent_of": [
          "B"
        ],
        "outputs": [
          "GLSL ES 3.00 numeric rules",
          "VAO/UBO state policy",
          "context-loss recovery plan"
        ]
      },
      {
        "lane": "E",
        "purpose": "validation and CI gates",
        "independent_of": [
          "B"
        ],
        "outputs": [
          "FBO completeness check",
          "PBO + fenceSync smoke readback",
          "context-loss restore drill"
        ]
      }
    ]
  },
  "deliverables": [
    {
      "type": "architecture-plan",
      "summary": "Tiered SDF face renderer with explicit VAO/std140 UBO state and async/serial split."
    },
    {
      "type": "feature-checklist",
      "summary": "P0/P1/P2 subject audit for facial anatomy and roughness zones."
    },
    {
      "type": "validation-plan",
      "summary": "Compile, FBO completeness, PBO readback, and context-loss checks before ship."
    }
  ],
  "risks": [
    {
      "severity": "high",
      "issue": "Soft shadows plus multi-tap AO may exceed phone fragment budget at DPR >= 2.0.",
      "mitigation": "Gate both by tier, clamp DPR first, then reduce shadow/AO step counts."
    },
    {
      "severity": "medium",
      "issue": "Anatomical credibility fails if eyelids, nostrils, or lip transitions are under-specified.",
      "mitigation": "Complete the P0 anatomical proportion audit before adding P2 skin micro-detail."
    },
    {
      "severity": "medium",
      "issue": "Startup hitching occurs if full SDF shader compilation blocks the first frame.",
      "mitigation": "Render a lightweight Frame 1 placeholder and poll COMPLETION_STATUS_KHR across frames."
    }
  ],
  "validation_gates": [
    "canvas.getContext('webgl2') succeeds and binds a dedicated VAO before gl.drawArrays(gl.TRIANGLES, 0, 3)",
    "All #version 300 es shaders compile and link with zero infoLog errors",
    "Async PBO + gl.fenceSync readback confirms non-clear RGBA pixels at viewport center",
    "WEBGL_lose_context drill restores VAO, std140 UBO, and shader program without gl.getError() failures"
  ]
}
